MOVIE_ID,NAME,ALIAS,ACTORS,COVER,DIRECTORS,DOUBAN_SCORE,DOUBAN_VOTES,GENRES,IMDB_ID,LANGUAGES,MINS,OFFICIAL_SITE,REGIONS,RELEASE_DATE,SLUG,STORYLINE,TAGS,YEAR,ACTOR_IDS,DIRECTOR_IDS
26163479,暖男电话,,彭禺厶/李妍憬,,焦洋,3.0,69,喜剧/爱情,,汉语普通话,62,,中国大陆,2014/10/17,a6mryF3ba,述了大陆屌丝弟弟“杨伟”爱上台湾女神姐姐“佩怡”后的爱情故事。其中“杨伟”不断以自己的“暖男”特色追求“佩怡”，而“佩怡”能在财富与爱情中选择后者，高度体现了现代女性的独立人格。至于女二号“斯斯”更是以“感情从来都是两厢情愿的，只要你喜欢就好”做出了成全对方之举，令人心酸之余万分感动。,2014/爱情/中国/彭禺厶/喜剧/电影/李妍瑾/大陆,2014,彭禺厶:1349114|李妍憬:1317614,焦洋:1343945
26295847,桃花侠大战菊花怪,,何文杰/于芷晴 Zhiqing Yu/张皓森/赵晨东/余又熙/周华,,关旭,3.0,625,喜剧/爱情,,汉语普通话,70,,中国大陆,2014/12/31,UBYJ3zr6e,在很久很久以前，有一朵名字叫做桃花侠的桃花，还有一 朵叫菊花怪的菊花，菊花怪有钱有势，到处作恶，没有人敢惹它，桃花侠是刚出炉的“江湖小手”但是一次去吃包子时捡到了江湖中失传多年的《桃花真经》，桃花侠练了许久，终于练到了炉火纯青的地步，但是他觉得他的一生少了些什么，就决定为每一朵花除恶。,烂片/喜剧/负分滚粗/爱情公寓/2014/烂片，不好看/中国/大陆,2014,何文杰:|于芷晴 Zhiqing Yu:|张皓森:|赵晨东:|余又熙:|周华:,关旭:
5044748,神奇,,黄晓明/郭采洁/金雅中/冯德伦/埃里克·马比斯/陈建州/黄奕/卡梅隆·安东尼/德怀特·霍华德/斯科蒂·皮蓬/易建联/王治郅,,胡雪桦,3.0,12748,剧情/爱情/运动,tt3457380,汉语普通话 / 英语,110,,中国大陆,2013/9/30,AQIfUReEf,冰山（黄晓明 饰）是一位游戏软件开发的高手，生活中酷爱篮球。胡椒（冯德伦 饰）与小黑（陈建州 饰）都是冰山开发团队的同事，也都是篮球的狂热爱好者。新的公司CEO上任，并带来一个好消息：公司即将全力开发一款高端篮球游戏——“神奇”。但是原来的开发团队中只有冰山一人可以继续留下来，原有的团队必须解散。,NBA球星/黄晓明/篮球/烂片/神奇/中国电影/2013/体育,2013,黄晓明:1041404|郭采洁:1274814|金雅中:1028329|冯德伦:1023278|埃里克·马比斯:1044914|陈建州:1317928|黄奕:1051051|卡梅隆·安东尼:1211611|德怀特·霍华德:1238251|斯科蒂·皮蓬:1136136|易建联:1319954|王治郅:1319997,胡雪桦:1314371
10756744,史前怪兽,传奇 / 传·奇,杜夫·龙格尔/斯科特·阿金斯/黄奕/李承炫/耿乐/詹姆斯·兰斯/莉迪亚·伦纳德/汤姆·奥斯汀,,埃里克·斯泰尔斯,3.0,4031,动作/惊悚/冒险,tt2369041,英语,89,,英国 / 中国大陆,2014/1/1,rqaMeyrEf,故事发生在一个无名湖泊之中，近日来，在湖泊附近接二连三的发生了数起死亡事件，犯罪现场十分血腥可怕，犯罪手段十分凶残，通过一些残留的影像和证据不难发现，袭击者并非人类，而很可能是隐藏在湖底的某种野兽。,3D/动作/冒险/惊悚/英国/黄奕/2013/英国电影,2013,杜夫·龙格尔:1040508|斯科特·阿金斯:1017912|黄奕:1051051|李承炫:1316563|耿乐:1274576|詹姆斯·兰斯:1104686|莉迪亚·伦纳德:1176933|汤姆·奥斯汀:1319894,埃里克·斯泰尔斯:1298602
25759887,匈奴王·阿提拉,,,,,3.0,163,动作/惊悚/奇幻,tt3184096,英语,85,,美国,2013/12/31,fMei7YRIf,"When American soldiers inadvertently steal Attila the Hun's secret riches, the wrath of the barbarian is awakened; the mummified warrior will stop at nothing to kill the intruders.[由HD一条街HD1TJ.COM编写]",烂片/动作/美国/美国电影/粗俗/科幻/2013/喜剧,2013,,
24774034,兽人战争,奥克斯战争,,,,3.0,428,动作,tt2333508,英语,0,,美国,2013/2/2,6eqyzVZRe,在一场战斗疲惫的前特种部队操作工买在偏远的美国西部牧场逃离世界。遇到一个奇怪的系列侵入者，包括一个美丽的精灵公主和美国原住民的神秘和兽族。当兽人入侵他产业，约翰必须放弃他隔离成为英雄之前，世界上发挥他龙神兽族。,美国/奇幻/我勒个去/渣渣/魔幻/烂片/战争/2013,2013,,
24872048,巴比伦迷雾,,张瑀希,,陈厦,3.0,111,剧情,tt6839160,汉语普通话,18,,中国大陆,2013/6/29,mjNAeqyFf,在一个阴雨霏霏的夜里，著名设计师匡文驾驶豪车奔驰在繁华都市的快速公路上。此时此刻，他正前去参加某个神秘派对。该派对人称巴比伦计划，身份莫测的女郎头戴面具，端坐观众席。舞台中央，来自全球各地最有影响力和魅力的相继登场，展示自己的风采。女人们则根据各自的判断竞价，出价最高的女人将买下那名最有魅力的男人。看似奢靡豪华，宛若梦幻，然而在过去六年里，从派对中胜出的男人全部消失。怀着隐秘目的的匡文毅然决然加入派对，并且作为最具魅力的男士由神秘女郎Victoria买下。,短片/陆川/中国/微电影/科幻/2013/国产电影/剧情,2013,张瑀希:1375880,陈厦:1384023
22263364,勇者必胜,勇者不败,西蒙·菲利普斯,,,3.0,179,动作,tt2740538,英语,82,,美国,2013/3/13,IvMmbiVva,一伙冷酷无情的蒙面恐怖分子因为某种原因而绑架挟持了英国首相的女儿，并在一个地下停车场构建防御工事、设置装置炸药。为了解救女儿，于是，一个训练有素的特种部队——SAS被派出，他们必须逐层对这栋建筑进行排查，逐一清除可能发生未知的危险，并且成功的安全解救人质。,动作/烂片/美国/烂片无疑/英国/犯罪/坑爹的特种部队啊/美国电影,2013,Tom Benedict Knight:|西蒙·菲利普斯:1007693|Christina Bellavia:,
21967905,怨灵人偶,怨灵人偶3D,汪东城/周奇奇/李逸朗/蒋婧/虞朗,,石井辉仪,3.0,1541,惊悚/恐怖,tt3007826,汉语普通话,84,,中国大陆,2014/12/31,J3VnVf6mb,毕业两年，许多人的命运已经有了天壤之别。平面模特林希（周奇奇 饰）曾经和大学男友高一峰（汪东城 饰）相知相恋，而如今她已成为钻石王老五宋冰的女友，养尊处优。某天她重逢老同学诸葛琴（蒋婧 饰），得知琴琴决定近期召集一次同学会。聚会当天，琴琴及其男友钱进（李逸朗 饰）、唐韵（沈夕浓 饰）以及高一峰悉数到来。刚刚落座没多久，林希感到头晕，之后更在洗手间遭遇恐怖事件。当她再度醒来，发现自己和同学们被囚禁在一个阴森恐怖的密闭场所。,汪东城/怨灵人偶/惊悚/恐怖/悬疑/中国电影/大东/中国,2013,汪东城:1275869|周奇奇:1314048|李逸朗:1239828|蒋婧:1321744|虞朗:1328465,石井辉仪:1328468
6874155,七个以下,,方·基默/文·瑞姆斯/鲁克·高斯,,凯文·卡拉威,3.0,783,惊悚/恐怖,tt1988781,英语,92,,美国,2012/4/17,zzjrqqMQe,一辆巴士在穿过山脉时坠毁，兄弟俩连同四个陌生人发现自己被困在雷雨中，而且一个猝死的乘客正死死盯着他们的脸。不久，惊魂未定的他们就被一个神秘男子救了出来。,恐怖/美国/乏味/烂片/惊悚/美国电影/不感兴趣/电影,2012,方·基默:1013761|文·瑞姆斯:1048129|鲁克·高斯:1027193,凯文·卡拉威:1400970
21832650,黑色大丽花,,,,,3.0,159,剧情/恐怖/犯罪,tt2359347,英语,0,,美国,2012/9/15,IBQIJJ3zb,她一直在调查谁谋杀了她的父亲，她一直和失明的弟弟生活在一起，然而她还有一个特殊的身份，被称为传说中的“黑色大丽花”，她开始了她的复仇计划。,犯罪/美国/惊悚/恐怖/电影/2012/小说改编/剧情,2012,,
20515028,塑料性,,,,,3.0,187,喜剧/爱情/情色,,韩语,60,,韩国,2012/1/25,AAmbUBmNe,一个很帅的和尚出山后 在首尔被多名美女诱奸了，破戒了！,情色/韩国/三级/女性/苍井空/爱情/韩国电影/文艺,2012,,
21327647,我为太极狂,,孔晴,,周文扬,3.0,240,剧情/喜剧,,汉语普通话,93,,中国大陆,,Qe6Quqayb,《我为太极狂》讲述的是一个来自美国的黑人拳手苏克，从来没有想到自己除了蛋炒饭、李小龙之外，会和中国有什么瓜葛。拳台上的遭遇使苏克的经纪人作出了让他去中国学习功夫的决定。当苏克极不情愿地来到中国后，却通过一个又一个的事实，让他深深地迷恋上了太极拳，见识到了中国武术的博大精深，折服于真正的中国武术精神，并且由此改变了自己的人生。,中国电影/烂片/太极/中国/动作/喜剧/孔晴/2012,2012,Dwain:|孔晴:1326471,周文扬:1326470
5157918,丽兹,,加里·布塞/柯宾·伯恩森/阿维娃·法布,https://img3.doubanio.com/view/photo/s_ratio_poster/public/p2527119882.jpg,,3.0,66,惊悚,tt1582213,英语,93,,美国,,Qm7uEJ3Ne,"Lizzie, a young woman with amnesia, slowly comes to realise that she may have been responsible for the horrific murder of her parents. After returning to the family home, Lizzie has terrifying flashbacks to her childhood, and comes face to face with the true horrors of her past.",惊悚/恐怖/这是个屎？？！/美国电影/美国/悬疑/庸俗/美國,2012,加里·布塞:|柯宾·伯恩森:|Shawna Waldron:|阿维娃·法布:|Don Swayze:|Gerry Bednob:,
7051307,哭笑不得,,王喜/萧蔷/柳岩,,罗斌,3.0,946,喜剧/爱情,tt2458444,汉语普通话,93,,中国大陆,2012/8/23,URAeayFJf,表情丰富的郑满堂（王喜 饰）利用自身特点，成立了情感陪护公司，专门为那些需要带动情绪的场合提供哭和笑的服务。美丽、睿智的莎莎（萧蔷 饰）因为不想继续只恋爱、不结婚的生活，毅然决定离开男友兼上司汤永孝，从此恢复了单身生活。,烂片/喜剧/无力吐槽/中国电影/柳岩/2012/大陆/王喜,2012,王喜:1024897|萧蔷:1275981|柳岩:1312846,罗斌:
6524192,肉体创伤,精英中队,,,,3.0,284,科幻,tt1461677,英语,81,,美国,,RA2jrq6Qe,一批为美军研制秘密武器的科学家神秘失踪。Tyler领导的海军陆战队员奉命前去查明真相，途中遭遇前所未见的强大敌人，一场大杀戮开始了……,烂片/超级烂片/科幻/美国/美国电影/血腥/2011/电影,2011,,
5161849,环球突击队,战栗时空中队(台) / 应召民兵 / 再造民兵,瑞利·史密斯,,,3.0,65,惊悚,tt1535606,英语,79,,美国,,3FBmrMAmb,"返回平民生活作为一个德州牧场主,队长兰斯Deakin fends了从以前的成员攻击他的单位来揭示他的斗争的真相就照一个战士在伊拉克。军方矛上进行实验和跟随他的人、要把它们变成super-soldiers和洗脑他们记得他们的绝密的任务hyper-violent内容的视频游戏叫“MINUTEMAN。兰斯必须揭开真相来救他所爱的女人。",烂片/美国/欧美电影/电影/差,2010,瑞利·史密斯:,
3395444,黑暗制裁,黑暗骑士 - 制裁,,https://img3.doubanio.com/view/subject/l/public/s3926991.jpg,,3.0,74,动作/科幻/冒险,tt1345449,英语,0,,美国,2009/2/1,qMuEJZRua,黑暗骑士，具有超凡能力的正义之士，这个神秘组织暗中执行正义，将法律无法伸张的恶徒就地正法，向街头犯罪宣战。,美国/动作/黑暗骑士/美国电影/黑暗制裁/2009/英语电影/科幻,2009,,
4908042,真知子老师真人版 无敌奶子组长,,相泽仁美/川口直哉/野村大輔/小池唯,https://img1.doubanio.com/view/photo/s_ratio_poster/public/p2511550749.jpg,植田中,3.0,101,剧情,tt1476993,日语,76,,日本,2009/9/4,yjj7QYZZf,真知子老师真人版 无敌奶子组长 実写版，相泽一副波大无脑代言人的姿态，主演这本以卖蠢为己任的系列片倒也适合。数个章节中也就最后水泳特训可看。小池唯的虎牙卖萌和及川奈央的制服诱惑是给像我这种对豪乳不感冒观客所准备的附加福利。得承认，这种令人...在线视频；,日本/情色/日本电影/甜性涩爱/动画改编/无聊/喜剧/you,2009,相泽仁美:|川口直哉:|野村大輔:|小池唯:,植田中:
3244619,惊变20年,,,https://img3.doubanio.com/view/subject/l/public/s3304225.jpg,,3.0,69,剧情/科幻/奇幻,tt0825279,英语,95,,美国,2008/8/31,mNYBQ2jjb,任何事情都有可能出错：战争，恐怖主义，自然灾害。从城市撤离了难民营周围县市。在战争，饥荒和疾病打击的幸存者。现在，二十年后，炸弹落和瘟疫，过了少数几个仍然生活在恐惧和没有希望的。该岛的明星莎拉在后世界末日的童话故事，一个年轻女人的旅程将在15年内第一个孩子出世。莎拉拒绝放弃的灵感在她的广播一个孤独的声音。迈克尔广播模糊和遥远的希望的消息和他从死者打扫的音乐。被迫从干旱的她的地下室家和那些谁想要她的孩子不断的追求，莎拉穿越的路径与迈克尔在海绵状，不同的幸存者的地下避难所。它是由..,科幻/美国/末世/烂片/反乌托邦/美国电影/2008/末日,2008,,
7051366,蛇王波后,人蛇浴血站之赌王斗赌后,彭丹/罗家英 Kar-Ying Law8/徐锦江,,缪建德,3.0,58,惊悚,,粤语,72,,中国香港,2006/2/22,BuaMIvMAe,最新香港灵幻恐怖巨作！变异蛇王嗜血大战豪乳波后！由香港著名艳星彭丹倾情主演，嗜血蛇王狂野来袭！豪情波霸性感出击！ 　　科学家明凯蒂与他男友肯迪以及一伙男女去深山寻找宝藏。当他们在深洞中发现宝藏时却惊动了洞中的护宝巨蟒。肯迪遭巨蟒攻击后被蛇魔缠身，凯蒂经研究发现，女人的爱液才是驱除蛇魔的最强药剂……,香港电影/蛇王/彭丹/情色/香港/恐怖片/2006/韩炜,2006,彭丹:|罗家英 Kar-Ying Law8:|徐锦江:1028828,缪建德:
3095376,山狗2003: 兽性陷阱,山狗2003之兽性陷阱,黄榕/张碧珊/大迫由美/何华超/金俊汶,,院志强,3.0,146,恐怖,tt9072080,粤语,83,,中国香港,,n72r6uMYf,一個與世隔絕荒島，兩個手無寸鐵弱女，三個滅絕人性兇性……Tiffany是一個廣告美術指導，與任廣告導演的男友Jeffrey一直合作無間。兩人正籌備一個日本產品廣告，Tiffany構思出一個藍天白雲的概念，Jeffrey遂計劃到一個渺無人煙的荒島進行拍攝。拍攝日子迫近，一切準備就緒。Tiffany與Jeffrey都估不到，這次將會是一次令二人畢生難忘的旅程……,山狗2003之兽性陷阱/情色/香港电影/香港/山狗2003/想想看/2003/山狗,2003,黄榕:1359026|张碧珊:1359040|大迫由美:1359037|何华超:1286723|金俊汶:,院志强:
4160439,决战芝加哥,,陈勋奇/陈杏妍/陈杏研/李佳/寇占文/战晓丹,https://img3.doubanio.com/view/photo/s_ratio_poster/public/p2364872991.jpg,祝力强/陈勋奇,3.0,127,剧情/动作,,汉语普通话 / 英语,83,,中国大陆,,qMAAuqMYf,家声是芝加哥的一名华裔警察，在办案中他受人陷害，先是被栽赃巨款，后是货柜车内藏毒，接着，搭档被杀、妻子刚刚生产后就惨遭车祸、年幼的女儿被绑架、弟弟又遭人利用……原来，这一切的幕后指使是他八年前亲手抓捕的黑帮头目本扎。当年本扎的弟弟死于那场对峙中，本扎发誓出狱后一定要报复家声。 为了澄清事实，替死去的亲人报仇，家声怀着家破人亡的痛苦和愤恨越狱而出。在弟弟和证人的帮助下，他躲过黑白两道的追堵，捣毁了本扎的老巢。而诡计多端的本扎调换了载有证供的便携式电脑，一旦输入正确的密码，藏在电脑中的烈性炸弹就会摧毁整幢警署大楼…… 危急时刻，家声能否力挽狂澜?,陈勋奇/2000/烂片/大陆/绝不看第二遍/犯罪/搞笑/动作,2000,陈勋奇:|陈杏妍:|陈杏研:|李佳:|寇占文:1315250|战晓丹:,祝力强:|陈勋奇:1280419
20438606,力王之真正敌人,,樊少皇/陈观泰/任港秀/陈观泰 Kuan Tai Chen/黎强权/行宇/罗棋/董立德,,田隽,3.0,86,剧情/动作,,汉语普通话 / 粤语,86,,中国大陆 / 中国香港,,qMmzVZnra,在拳坛上亚虎唯一的愿望，就是能和拳坛冠军力王比较高下，亚虎终于向力王挑战，苦战十五回合，虎﹑力二人打得落花流水，始终未能分出谁胜谁负，在此情况下，亚虎及力王均重伤入院，力王因眼睛严重受伤，不能再打拳赛，若再打拳，可能影响视力，力王从此离开拳坛。此次拳赛在经济上对力王没有太大帮助，但令他声名大噪 ; 之后得到一笔小奖金，并分期付款买了一间屋和一部亚虎自小便心爱的电单车，本以为从此可以过？平凡和无忧无虑的生活，不料当他们正过？幸福的日子时，力王突觉视力减退，在工作上错事百出而被公司解雇，再去求职亦处处碰壁，此时小植已有身孕，在生活入不敷支的情况下，小植惟有回到原来的工作酒家工作，不幸操劳过度，受伤入院，力王因此重出拳坛。在一次拳赛中，因力王想念在医院中的小植而被打败，后来经过教练泰叔一番鼓励及指点，在医院的小植已苏醒起来，亚虎要挑战力王的消息植已得知，植唯有加以鼓励……,樊少皇/动作/中国电影/香港电影/国产电影/烂片/1995/呃呃呃,1995,樊少皇:|陈观泰:1028360|任港秀:|陈观泰 Kuan Tai Chen:|黎强权:1316555|行宇:|罗棋:|董立德:,田隽:
30190607,钢铁飞龙之奥特曼崛起,,,,王巍,3.1,2034,动作/科幻/动画,,汉语普通话,90,,中国大陆,2019/1/18,Ef6AYv6ea,创世晶石危机一触即发，为了阻止地球毁灭，奥特曼选择了看似平凡的小男孩乐乐作为自己的人间体，面对重重挑战，原本调皮捣蛋的小屁孩在奥特曼的引导下，成为拯救地球的关键人物，而奥特曼超能力的秘密也逐渐被揭晓……,烂片/圈钱的垃圾玩意/无耻/毁童年/低俗/动画/毁/中国大陆,2019,,王巍:1353662
34454172,宇杀员,,,,,3.1,75,科幻/恐怖,tt5300154,英语,83,,美国,2019/7/30,RAmFnV3jb,"In the near future, aliens have invaded Earth and declared a galactic war resulting in thousands of human casualties. To save Earth, a team of four teenage astronauts brave the alien wilderness of a distant planet to stop an assassin from changing the course of history forever.",科幻/惊悚/美国/美国电影/烂片/少年/2019/浪费时间,2019,,
30162669,史前巨鳄遗产,普莱西德湖：传奇,凯瑟琳·巴雷尔/蒂姆·罗尊/赛·班尼特/格雷格·克列克,,达雷尔·鲁特 Darrell Roodt,3.1,425,恐怖,tt7875948,英语,0,,美国,2018/5/28,UBmF37m7e,故事发生在首部电影的数年之后，一群年轻的探险家们深入秘境，想找出这个在地图上被抹去的地点、其隐藏在通电围栏背后的秘密。当他们深入湖中心，他们发现了一个有著废弃工厂的小岛，而这裡正有著恐怖的遗产：这个岛属于一群致命掠夺者，它们迫不及待地想要大快朵颐任何来客。,美国/惊悚/恐怖/怪兽/2018/烂片/科幻/剧情,2018,凯瑟琳·巴雷尔:1356897|蒂姆·罗尊:1138768|赛·班尼特:1339474|格雷格·克列克:1353557,达雷尔·鲁特 Darrell Roodt:
30234966,暴走狂花,,赵奕欢/包文婧/张天其/袁伶嫣/李笑优/李艺东,,毛溦,3.1,486,喜剧/动作/悬疑,,汉语普通话,85,,中国大陆,2018/6/1,jFZBYZvyb,体校不同专业的优秀学生顾蕾和白若楠从大学起就不对付，同在一个宿舍却经常比武斗技，而且每次都被思政老师高婷婷抓个正着。,烂片/动作/没有逻辑/中国大陆/搞笑/喜剧/爆乳/暴走,2018,赵奕欢:1315294|包文婧:1321296|张天其:1318375|袁伶嫣:1376277|李笑优:|李艺东:,毛溦:
30282678,没有好英雄,,,,,3.1,142,剧情/喜剧/科幻/恐怖,tt4839414,英语,0,,美国,2018/7/24,3zrirayzb,"After living peacefully in the caverns of a small town, a stranded group of aliens turn deadly as they fight for their existence, betraying the compassionate chief of police who has protected them for 28 years.",科幻/外星人/美国/惊悚/垃圾！！！/美国电影/喜剧/2018,2018,,
30337041,异形远征队,侏罗纪远征队,爱德华多·古斯特斯,,,3.1,205,科幻,tt8305690,英语,93,,美国,2018/9/27,zrirq6A2b,深太空探测船发现一个潜在的可居住的星球后，派遣了生化人和人类组成的远征队，去调查星球资源，而其实，这是一颗全是异形的星球……,科幻/烂片/美国/傻缺剧本/2018/美剧/剧情牵强，表演牵强。效果6毛/荷兰,2018,C.J. Baker:|Ethan McDowell:|爱德华多·古斯特斯:1315285|Gregory Niebel:|Whitney Nielsen:,
26960408,死亡故事,,,,,3.1,151,恐怖,tt4282872,英语,81,,美国,2017/1/20,If6QYviNe,因婆媳关系不好，新婚夫妇安妮和哈罗德在离母亲远的乡下买了一套旧房，旧房是朋友尼尔介绍的。搬进第一天，尼尔夫妇过来探访，尼尔讲了一“死亡故事”，——玛丽在凌晨2点，无缘无故拿刀捅死了丈夫亚伯，而且捅了40刀，事后将亚伯挂于仓库；清晨，警察赶到，玛丽竟不知发生了什么，仅告诉警察房间有鬼。尼尔半开玩笑说故事就发生在这个房间。故事近似玩笑，安妮没在意。,恐怖/美国/2017/恐怖片/美国电影/烂片/垃圾/恐怖电影,2017,,
27002628,中央公园,,露比·莫迪恩/格蕾丝·范·帕滕/玛瑞娜·斯奎尔西亚提/迈克·隆巴迪/大卫道森/苏梅里娅·哈里斯/贾斯汀·莱茵西尔伯,,贾斯汀·莱茵西尔伯,3.1,80,惊悚/恐怖,tt4788736,英语,90,,美国,2017/6/6,EvEBu6AQe,"Central Park is a unique, genre bending thriller/horror film that spans one night in the worlds' most famous park. Six best friends, high school students, prepare for a night of fun. School is boring, family life unbearable, and Harold and his friends have turned Central Park into their 'spot'. Young and invincible; Harold and his crew own this city. Unbeknownst to them, a revenge-seeking executioner prepares to kill them off one by one to pay for the sins of the father.",惊悚/美国/恐怖/烂片/垃圾/2017/这拍的是个什么玩意/美国电影,2017,露比·莫迪恩:1365373|格蕾丝·范·帕滕:1373419|玛瑞娜·斯奎尔西亚提:1317603|迈克·隆巴迪:1189765|大卫道森:1345155|苏梅里娅·哈里斯:1377007|Sarah Mezzanotte:|Guillermo Arribas:|Jordyn DiNatale:|Nicole Balsam:|贾斯汀·莱茵西尔伯:1326416|Aaron Roman Weiner:|Claudia Peters:|Justiin A. Davis:|Charles Borland:,贾斯汀·莱茵西尔伯:1326416
26857684,盗墓迷情之千年王妃,盗墓迷情之厄难王妃,程媛媛/陈锦昀/王萧寒,,秦教授,3.1,128,爱情/悬疑,,汉语普通话,63,,中国大陆,2017/1/13,yraUvMuUf,被海昏刘贺强抢的美貌绝冠县令之女李静香，新婚之夜吞下私定终身叶孤航赠与的凤鸣石，变成厄难之体的她意外让刘贺之子惨死，被活埋千年之后被盗墓者们意外放出……,盗墓/悬疑/穿越/国产烂片/看/2017/国产片/烂片,2017,程媛媛:1313238|陈锦昀:|王萧寒:,秦教授:
27097814,生化药尸,天师救僵,钱小豪/楼南光/吴耀汉/胡向真/刘佳佳/罗天池/庞景峰,,梁嘉铭,3.1,366,喜剧/动作/惊悚,,汉语普通话 / 粤语,90,,中国大陆,2017/7/31,BQeEnr6mb,影片讲述了神医李药师(钱小豪饰演)在遭遇师兄雷万龙(楼南光饰演)后，被胁迫去治疗感染僵尸病毒的少帅，并由此展开了一段光怪陆离的冒险，也揭开了一个尘封多年的秘密。,僵尸/钱小豪/香港/香港电影/林正英徒弟/惊悚/喜剧/楼南光,2017,钱小豪:1005415|楼南光:1289501|吴耀汉:1037408|胡向真:1379513|刘佳佳:1319475|罗天池:1353701|庞景峰:1401079,梁嘉铭:
27054612,笔仙咒怨,笔仙VS伽椰子,罗翔/李佳颖/江兰萱/俞晓晔/马卉/徐勇/粟军/郑晓勇,,邓安东,3.1,574,悬疑/惊悚,,汉语普通话,96,,中国大陆,2017/12/1,iVZviVZZf,故事讲述了开发商安东想强拆何倩倩外婆的老宅建成一片别墅区。为了不让安东强拆老宅，何倩倩暑假和同学江佳琪一起回到了老宅，初恋王晓峰还有一群初中同学陪着她想出了一个请笔仙装鬼的办法吓走开发商，可后来事情扑朔迷离，诡异事件接连发生，人心惶惶，到底有什么未知的恐惧在等待着他们......,烂片/恐怖/脑残片/惊悚/大烂片/国产/智障片/搞笑,2017,罗翔:1341569|李佳颖:1378792|江兰萱:1378788|俞晓晔:1378789|马卉:1378790|徐勇:1378791|粟军:1384365|郑晓勇:1384366,邓安东:1319338
26661183,抢红,Z计划,张涵予/黎明/王耀庆/杜鹃/南伏龙/黄尚禾/吉丽/苍井空,,黎明,3.1,6041,动作/犯罪,tt3699104,汉语普通话,90,,中国大陆,2017/5/19,InzjVR2zb,朝不保夕的司机张水（张涵予 饰），受上司方长方（王耀庆 饰）利诱，答应亲赴法国邀请义弟韦力（黎明 饰）帮忙参加天价红酒的竞拍。张水谎称为国家执行秘密任务骗得韦力的信任，一同前往品酒大会。拍卖现场，张水意外的发现指使自己来参加拍卖会的老板方长方也在现场，而此时的方长方好像从没认识过张水...品酒会的主持者利芳（杜鹃 饰）与各路买家逐一品酒，只有通过考验的人才可以参与到竞拍环节。,烂片/2017/动作/喜剧/华语/中国/犯罪/硬汉,2017,张涵予:1274319|黎明:1036978|王耀庆:1316330|杜鹃:1323516|南伏龙:1363931|黄尚禾:1330444|吉丽:1344838|苍井空:1217486,黎明:1036978
