MOVIE_ID,NAME,ALIAS,ACTORS,COVER,DIRECTORS,DOUBAN_SCORE,DOUBAN_VOTES,GENRES,IMDB_ID,LANGUAGES,MINS,OFFICIAL_SITE,REGIONS,RELEASE_DATE,SLUG,STORYLINE,TAGS,YEAR,ACTOR_IDS,DIRECTOR_IDS
25962681,精武青春,天使高校,吴千语/徐正溪/夏嫣/林德信/张楚楚/刘以达/阮德锵/宋佳/黄百鸣,,邱礼涛,3.5,722,喜剧/爱情,tt4539364,汉语普通话 / 粤语,87,,中国香港 / 中国大陆,2014/12/4,jFnVBuyra,出身豪门、为人粗枝大叶又自我中心的芷程（吴千语 饰）因为父亲工作的关系转学到南斗学院。在陌生的环境中，芷程重遇多年不见的表哥志坚（林德信 饰），虽在表面上对志坚刁蛮任性，但内心亦不禁视他为唯一的依靠。南斗学院校规严格，同宿舍的美云（张楚楚 饰）又是个难以相处的奇怪姑娘，一切都与昔日自由的生活大相径庭，让自由散漫惯了的芷程度日如年。偶然的机会，芷程结识了校草、武术队的大师兄文安（徐正曦 饰）并对他一见钟情。为了追求文安，热血上头的芷程加入了武术队，不仅要面对文安的不解风情、“情敌”大师姐铁岚（盛君 饰）的刁难，还要挑战武术队的重重难关。,香港/青春/烂片/喜剧/电影/2014/吴千语/爱情,2014,吴千语:1316503|徐正溪:1313748|夏嫣:1326280|林德信:1336855|张楚楚:1326520|刘以达:1034328|阮德锵:1317685|宋佳:1274921|黄百鸣:1275277,邱礼涛:1274313
25968017,诱惑单行道,,许瑶璇/魏鹏,,张涛,3.5,53,剧情/爱情,,,62,,中国大陆,2014/8/26,raayjNIBe,李景川（魏鹏 饰）是一个摄影师，靳雯（许瑶璇）是时尚界的经纪人，她来找李景川合作拍摄相册。而为李景川的创作进行投资的出版商林伟森（李金声 饰）是靳雯的男友，所以李景川、靳雯之间的关系异常微妙。二人在创作的同时也碰撞出了爱情的火花。 林伟森得知靳雯背叛自己之后，提出与李景川签订一个魔鬼交易：自己为李景川的相册在欧洲出版提供资助，但李景川必须永远离开靳雯，否则他必须赔偿给自己150万元的违约金。面对两难选择，李景川却做出了一个出人意料的决定……,爱情/烂片/剧情/大陆/中国电影/青春/中国/2014,2014,许瑶璇:1334951|魏鹏:,张涛:
25966081,东泉宾馆,,何强/刘惟祎,,张琪东,3.5,71,悬疑/恐怖,,汉语普通话,0,,中国大陆,2014/8/10,bMuyVR2zb,本片讲述一群年轻人到木兰山一座废弃的别墅东泉宾馆度假，牵引出一桩民国冤案的故事。,恐怖/悬疑/蛇从革/东泉宾馆/中国电影/灵异/2014/烂片,2014,何强:1324676|刘惟祎:,张琪东:
25723932,激情联盟,联合激情(台),费舍·史蒂芬斯/托马斯·克莱舒曼/蒂姆·罗斯/山姆·尼尔/杰迈玛·韦斯特/热拉尔·德帕迪约/理查德·迪兰/杰森·贝瑞/安东尼·希金斯/马丁·贾维斯/安东尼奥·德·拉·托雷/布鲁斯·麦克金伦/塞尔奇·哈赛纳维奇/斯蒂文·埃尔德/尼古拉斯·格利夫斯,,弗里德里克·奥伯汀,3.5,33,剧情,tt2814362,英语,110,,法国,2014/5/18,yFBeUvyNe,一套2014年的法国英语剧情片，讲述了国际足球总会的诞生。本片超过90%经费由FIFA赞助，由提姆罗斯、杰哈德巴狄厄和森尼尔等人主演，弗里德里克奥伯汀执导。本片于美国上映的首週仅获约六百美金票房，堪称影史票房另类纪录，并且由于纷传不断的足协总会收贿丑闻，本片网路媒体评价甚差。,足球/TimRoth/2014/法国电影/體育/法国/国际足联腐败/传记,2014,费舍·史蒂芬斯:1036474|托马斯·克莱舒曼:1049595|蒂姆·罗斯:1025176|山姆·尼尔:1049525|杰迈玛·韦斯特:1161570|热拉尔·德帕迪约:1013845|理查德·迪兰:1335290|杰森·贝瑞:1036813|安东尼·希金斯:1045213|马丁·贾维斯:1106152|安东尼奥·德·拉·托雷:1080650|布鲁斯·麦克金伦:1173535|塞尔奇·哈赛纳维奇:1317751|斯蒂文·埃尔德:1321656|尼古拉斯·格利夫斯:1321843,弗里德里克·奥伯汀:1018761
25722123,爱情狂想曲,,李威/苏小妹/童苡萱/付曼/秦汉擂/崔文璐/于金龙,,丛兿,3.5,347,喜剧/爱情,,汉语普通话,96,,中国大陆,2014/11/28,yrybURIRe,张成功（李威 饰）拥有着英俊帅气的外表，刚刚从国外留学归来的他顶着牙医学博士的头衔，在国内收到了各种莺莺燕燕的殷勤追捧。然而，张成功的眼里只有一个人，那就是韩雪霏（苏小妹 饰），可是韩雪霏对待张成功的态度却非常的冷淡，不仅如此，她的个性大大咧咧，是一个实打实的女汉子，韩雪霏身上究竟是哪一点在深深的吸引着张成功呢？,爱情/烂片/2014/喜剧/内地电影/剧情/中国/李威,2014,李威:1317664|苏小妹:1334215|童苡萱:1335604|付曼:1337947|秦汉擂:1327158|崔文璐:1334226|于金龙:1344024,丛兿:1344025
25871713,渴望的青春,圣地渴望,吴昊泽/张晏精/何婷贤/李夏佩/赵斌/王晓卯/曲国强/杨晓彤/常帅/余多,,马雍,3.5,117,剧情,,汉语普通话,107,,中国大陆,2014/5/9,RmFfM27If,日前，由国家一级导演马雍执导，吴昊泽、赵斌、王晓卯、张晏精、曲国强等实力派青年演员领衔主演的青春题材电影《圣地渴望》在重庆举办了盛大的开机发布会。内地新生代女演员王晓卯出席了该影片的开机发布会并确认加盟到创作中，更有神秘粉丝给王晓卯送来666朵蓝色妖姬，祝该剧开机大吉，拍摄顺利。,重大/烂片/我只能说电影里的大学和现实中的很不一样/毁三观/青春/中国/2014/？,2014,吴昊泽:1339825|张晏精:1339826|何婷贤:1339827|李夏佩:1339828|赵斌:|王晓卯:1339830|曲国强:1318657|杨晓彤:1339833|常帅:1339831|余多:1339832,马雍:1339824
25798808,死亡邮件,,任泉/乔任梁/张杨果而/李彧/周泓/曹阳/白瑶,,李彧,3.5,4004,悬疑/犯罪,tt6419578,汉语普通话,90,,中国大陆,2014/6/20,i7Ivaa6Ae,司徒明浩（任泉 饰）和赵勇（乔任梁 饰）是在同一间杂志社工作的同事兼好友，两人相识多年，彼此之间的友谊十分坚固。最近，他们将杂志的焦点聚集到了一宗人体器官倒卖案件之上，在调查取证的过程中，赵勇意外失踪，之后等待着司徒浩明的，则是赵勇的死讯。,乔任梁/悬疑/惊悚/任泉/2014/烂片/中国电影/中国,2014,任泉:1274821|乔任梁:1275913|张杨果而:1317197|李彧:1316548|周泓:1314530|曹阳:1337326|白瑶:1339731,李彧:1316548
6147308,我在路上最爱你,在路上 / 三日三夜,黄圣依/池珍熙/车秀妍/文章/张少华/翟子陌,,金丰起,3.5,10901,剧情/爱情,tt4339118,汉语普通话 / 韩语,94,,中国大陆 / 韩国,2014/3/28,uUfq6IBmb,在一列南下的列车上，故事的主人公周涣与水晶不期而遇，共同度过一段美好时光，虽然这样的相遇在别人看来不可理喻，但此刻在他们心中却彼此慰籍。,爱情/烂片/文章/黄圣依/2014/中国电影/中国/大陆,2014,黄圣依:1005110|池珍熙:1010449|车秀妍:1023715|文章:1011513|张少华:1274644|翟子陌:1319611,金丰起:1338456
25837802,欲望北京之地上地下,地上地下,孙逢苑/马邵男/张漫文/李佳凌,,郎宏伟,3.5,192,剧情,,汉语普通话,70,,中国大陆,2014/3/20,e6IfEJfUf,雨辰在内地老家因为酒后误伤被判入狱，出狱后在一个好友秦小东的安排下让他到北京发展。谁知道秦小东在北京不务正业，并且欠下了很多债务和好几个月的房租，当他安排雨辰到地下室入住后，借故出去办事把他的带来的一万元钱拿走后就消失了。雨辰只有吧身上唯一值钱的手表抵押了房租继续住在地下室并开始了每天去寻找工作和机会。,中国电影/大陆/2014/烂片/爱情/中国/青春/微电影,2014,孙逢苑:|马邵男:|张漫文:|李佳凌:,郎宏伟:
26298076,谋逆,,李梦/张小冉/林沫辰,,郭虎,3.5,60,爱情/悬疑/犯罪,,汉语普通话,62,,中国大陆,,ERQAIBuaa,天宇集团二公子连俊（季森 饰）被人发现坠楼身亡，经警方初步判定这是一起自杀事件。在此之后，连俊的哥哥连宇（李天烨 饰）及其妻子李颖（林沫辰 饰）成为公司股份最大的持有人，不过围绕董事长的宝座，这对同床异梦、各怀鬼胎的夫妻展开了明争暗斗。事实上在连氏兄弟的父亲去世之前，曾哀叹连宇夫妻野心勃勃，关系不和，于是将所持有的股份都交给连俊，这也为这个善良的男子惹来了杀身之祸。在狂魔乱舞的夜店，连宇勾搭上妖艳美丽的肖依（张小冉 饰）。一夜欢愉之后，自视甚高的连宇聘请肖依帮其抓住老婆偷情的把柄，并借机抢过李颖手中的股份。,烂片/犯罪/悬疑/中国/爱情/中国电影/谋逆/朱晓光,2014,李梦:|张小冉:|林沫辰:,郭虎:
26258896,阿登的狂挫,阿登之狂怒 / 狂怒之阿登战役,提诺·斯特劳克曼,,,3.5,121,动作/战争,tt3922754,英语,87,,美国,2014/11/11,bUfERuq6e,本片是由Joseph J. Lawson执导的一部影片。1944年，战事如火如荼，一支美国的坦克队伍英勇作战，却难敌纳粹军队的攻击，屡屡败退，千钧一发之际，他们找到了突破口，终于冲出敌军的防线。然而此时坦克燃料用完，他们不得不步行前进，路上他们遇到了一个修女，并从修女口中得知不远处孤儿院还有许多孩子等待救援，原本负责保护他们的美军护送队已被德军处决，修女执意回去保护孩子，为了保护无辜的人们，士兵们跟随修女来到了孤儿院……,二战/烂片/战争/美国/美国电影/2014/最近几年看的最烂片/恶搞,2014,Tom Stedham:|Bill Voorhees:|提诺·斯特劳克曼:1018636,
26265176,致青春兄弟篇,,豆艺坤/张雪/郑旭东/肖若明/郭鑫/姜施,,郑航,3.5,87,剧情,,汉语普通话,83,,中国大陆,,A2zbairyb,这是一部关于80.90后回忆崛起的怀旧影片，讲述了东北某镇上以核心人物张伟（绰号龙少），兄弟闯子，二胖，大鹏为首的手足兄弟情，校园内外，喝酒，抽烟，打架，追女孩是标志着一个男孩到男人的蜕变。我们被社会青年无辜的欺负打压，而当龙少面对兄弟之间的情谊深切，该如何保护自己的兄弟，躁动的青春被热血点燃，爆发出新的极点，祭奠那光辉岁月，不同的性格，不同的人生态度，让他们的每个人经受着痛苦与考验，校园的生活已不在美好，危机重重，形势严峻，那些往日的兄弟情深，是否已经灰飞烟灭，年少轻狂，只为一个“义”字。,青春！兄弟...！/兄弟/青春/中国电影/微电影/剧情/现实/烂片,2014,豆艺坤:|张雪:|郑旭东:|肖若明:|郭鑫:|姜施:,郑航:
10773447,电梯惊魂,地下十八层,蓝正龙/周秀娜/谢君豪/蔡鸿翔/杨青/罗伯特·林,,宁敬武,3.5,2247,悬疑/惊悚,tt2192624,汉语普通话,88,,中国大陆,2013/2/22,62zjFfMua,阴冷诡异的半岛医院，夜深人静时分，灯光闪烁昏暗，在该医院供职的马护士（杨青 饰）意外惨死电梯间，掀开了一连串恐怖和诡异事件的序幕。院长林思远的儿子林飞（蓝正龙 饰）英俊帅气，早年在国外求学，回国后在半岛医院外科担任医生，并与美丽的女护士白洁（周秀娜 饰）相恋，既让人羡慕又遭人忌恨。外科张主任（罗伯特琳 饰）因论文涉嫌剽窃保守苛责，他怀疑林飞暗中使坏，不久自己也如马护士一般落入了本不存在的地下第十八层，走出电梯后他精神失常，坠楼而亡。曾与之争吵的林飞自然受到怀疑，而时刻逡巡在医院内的鬼影搅动着所有人的神经。伴随死亡，真相逐渐揭开……,惊悚/恐怖/烂片/悬疑/中国/2013/蓝正龙/大陆电影,2013,蓝正龙:1275624|周秀娜:1313563|谢君豪:1157914|蔡鸿翔:1321149|杨青:1315091|罗伯特·林:1010772,宁敬武:1315135
20266733,韩赛尔与格蕾特,人肉滿屋(台),迪·沃伦斯,,,3.5,390,恐怖,tt2415464,英语,0,,美国,2013/1/8,eaybEfqEf,虽然成年但还不成熟的汉斯得知父亲即将卖掉房子和继母去周游世界非常生气，跟姐姐格雷特争吵后独自一人跑进森林，半路被巨大的夹子夹伤脚腕，幸好被追上来的姐姐所救，两人搀扶着来到森林中的一件小木屋，叫门后前来开门的原来是糖果店的老板，随后姐弟俩在糖果店老板丰盛晚餐的招待后先后昏厥。第2天醒来后，格雷特发现自己躺在卧室，坐在摇椅上织毛衣的糖果店老板告诉他汉斯已经被送去医院，然而格雷特在帮助屋主打扫卫生的时候无意发现箱子底下一块带血的人指甲，格雷特开始怀疑事情并不那么简单，残忍而又恐怖的事情正在屋里的某处发生……,烂片/美国/恐怖/血腥/童话改编/美国电影/烂/惊悚,2013,迪·沃伦斯:1168883|Brent Lydic:|Stephanie Greco:,
25769236,舞者的秘密教学,鬼舞,林宁/金立,,朴树苗,3.5,148,喜剧/惊悚,,韩语,51,,韩国,2013/10/2,uaEvaUJZf,"本片由韩国知名导演朴树苗拍摄,剧情采用非常悬疑以及古怪搞笑的风格在里头!讲诉了一对男女到小镇旅游,住在美丽的女房东家里!而女房东是一个爱钱并且好色的女人.经常偷听男女房间的声音!直到有一天,三个人闯入了这对男女的生活里,告诉他们!这个女房东其实是个女鬼.....",韩国/情色/韩国电影/情色片/电影/2013/走马观花/惊悚,2013,林宁:|金立:,朴树苗:
11632433,哭恋,,王大治/王二妮/李少飞/李凤鸣/陈长海/刘雪萍/黄精一,,李济德,3.5,103,剧情/爱情,tt7184626,汉语普通话,93,,中国大陆,2014/1/10,Me627eiFf,女青年王小花（王二妮 饰）失去心爱的恋人后陷入极度悲伤，心仪王小花的同村男青年张善良（王大治 饰）为给王小花排遣悲伤情绪，试了多种办法都无济于事。后来，张善良用村里的高音喇叭放了一首优美动听的民歌《口弦弦》，王小花的眼泪如泉水般涌出，张善良的良苦用心终于打动了王小花。而王小花前恋人李长寿（李少飞 饰）甘愿牺牲自己的爱情成全王小花的人间大爱，更是感人至深。,王二妮/王大治/中国/喜剧/口弦弦/我看过的电影/反胃/我看过的华语电影,2013,王大治:1314858|王二妮:1330349|李少飞:1330352|李凤鸣:1334338|陈长海:1336946|刘雪萍:1336947|黄精一:1328656,李济德:1329856
22521622,飞天猴子,,伊莱克特拉·阿维兰/克里斯托弗·马修·库克/泰勒·福雷斯特,,,3.5,175,科幻/恐怖,tt2205652,英语,86,,美国,,NQQIBmjra,,恐怖/美国/科幻/烂片/惊悚/2013/电影/美国电影,2013,伊莱克特拉·阿维兰:1022796|Alvin Chon:|克里斯托弗·马修·库克:1352714|Michelle DeVito:|泰勒·福雷斯特:1355050|Mike Kimmel:|David Kranig:,
24827543,第101场婚礼,,刘骐/董晴/李鑫雨,,马成赟,3.5,42,剧情/爱情,,汉语普通话,94,,中国大陆,2012/5/1,AuMIn7eqa,刘树是一位年轻的婚庆司仪兼婚礼策划师，他因为在一次婚礼上揭穿了准新郎的谎言而被开除。误打误撞，来到新公司后，他成了远近闻名的婚庆“试炼师”，专为心存疑虑的新人们进行测试。,爱情/中国/中国电影/2012/董晴/大陆/2016/马成赟,2012,刘骐:|董晴:|李鑫雨:,马成赟:
21354159,水面之下,,,,,3.5,41,恐怖,tt2215366,英语,82,,加拿大,,yjri7ei7e,"Sticky and hot from the long drive to visit a relative at their newly acquired, remote, rural farmhouse, Sam and Jason, a young couple on vacation, decide to swim in a pond they find at the end of a freshly cut path. While swimming, Jason is bitten by a strange leech-like organism. When he attempts to remove the creature, part of it rips off and crawls inside his leg. Back at the house, Sam’s sister and her family have yet to return. As time progresses, the injury on Jason’s leg worsens into a rapidly spreading infection, and strange clues begin to reveal that there may be more to their host’s absence than it previously appeared. It soon becomes a race against time to discover what happened to Sam’s sister and her family and what lies in store for Jason, faced with his physical and emotional disintegration.",加拿大/烂片/水面之下/恐怖片/恐怖/良好/科幻片/科幻,2012,,
6876044,活死人之夜3D：复活,活死人之夜3D:复活,安德鲁·迪沃夫/杰弗瑞·考姆斯/罗宾·西德尼,,杰夫·布罗德史崔特,3.5,211,恐怖,tt1879012,英语,88,http://www.nightofthelivingdead3d.com/re-animate.html,美国,,jVvMYJ3Ff,"After inheriting the family mortuary, a pyrophobic mortician accidentally exposes hundreds of un-cremated bodies to toxic medical waste. As the corpses re-animate, the mortician's inheritance-seeking younger brother unexpectantly shows up, stumbling upon a full zombie outbreak!",丧尸/美国/恐怖/惊悚/丧尸片/僵尸/2012/烂片,2012,安德鲁·迪沃夫:1010649|杰弗瑞·考姆斯:1049736|Sarah Lieving:|罗宾·西德尼:1198425,杰夫·布罗德史崔特:1042096
24858298,撞机,灾难课程 / 空中浩劫 / 死亡碰撞航线,蒂亚·卡雷尔/迪·沃伦斯/尼古拉斯·圭拉科,,弗雷德·欧伦·雷,3.5,103,剧情/动作/科幻/惊悚/冒险,tt2474984,英语,89,,美国,2012/12/17,QYfMeMuUf,"Kate Parks has spent the past year on tour promoting her book, an in-depth look at the attempted cover up of her husband's death in a plane crash. Now all she wants is to return home to her daughter, 15-year-old Samantha. But when a powerful solar flare strikes her flight home, killing the pilot, knocking out the co-pilot and frying all the electronic systems on the plane, it looks like she may not get there. As panic sets in among the passengers, Kate works with flight attendant Jake to manage the growing chaos and tension on the plane as she tries to keep 30,000 tons of steel hurtling through the air at 500 miles per hour. Flying blind, Kate tries to find a way to communicate with air traffic control - one way or another, this plane is coming down. With the passengers' lives on the line, Kate will have to find a way to land safely... or never see her daughter again.",灾难/美国/美国电影/无聊/烂片/烂/垃圾/删除电影,2012,David Chokachi:|蒂亚·卡雷尔:1013805|Meghan McLeod:|Tim Abell:|Janis Peebles:|Dylan Vox:|迪·沃伦斯:1168883|Marc Barnes:|Jon Briddell:|尼古拉斯·圭拉科:1093649|Anne Montavon:|Ted Monte:|Chris Prinzo:|Scott Thomas Reynolds:,弗雷德·欧伦·雷:1054364
5446249,热爱岛,热恋岛,吴镇宇/宋佳/任达华/陈冲/张震/文咏珊/黄维德,,甘国亮,3.5,2143,喜剧/爱情,tt1852069,汉语普通话 / 粤语,93,,中国大陆 / 中国香港,2012/6/1,3NAuqEZBe,为改变科技环境，赛西满（任达华 饰）把项目带到美丽的小岛上做科学实验，正当进行的一帆风顺之际，他的前妻祖安娜（陈冲 饰）不期而至，对他的生态项目横加指责。赛西满坚持自己的项目论证，但安娜遣责他的项目会给岛上带来生态灾难，双方互不相让。舟翰（吴镇宇 饰）是岛上的医生，与双腿残疾的妻子泛丽（小宋佳 饰）关系一度紧张，但随着时间的推移，貌合神离的夫妻关系渐渐融洽。珍妮丝（文咏珊 饰）是岛上的导游，一本偶然撷得的日记本洗涤着她充满幻想的心扉，日记本的主人是远在异国的金尚澈（张震 饰），他和珍妮丝能迸发出怎样的火花呢......,爱情/香港/2012/烂片/喜剧/任达华/陈冲/中国,2012,吴镇宇:1037098|宋佳:1042341|任达华:1031194|陈冲:1044964|张震:1077991|文咏珊:1275670|黄维德:1030201,甘国亮:1050798
10581450,我爱灰太狼,喜羊羊与灰太狼暑期大电影 / 喜羊羊与灰太狼真人大电影,赵娜/梁颖/祖晴/高全胜/邓玉婷/刘红韵/朱予同/张琳,,朱枫,3.5,2383,喜剧/动画/冒险,,汉语普通话,91,,中国大陆,2012/8/10,IZZfUvqaa,阳光明媚的日子里，青青草原上灰太狼（张琳 配音）和喜羊羊（祖丽晴 配音）他们围绕被抓获的懒羊羊（梁颖 配音）又你来我往展开斗智斗勇的对决。正在关键时刻，狼堡发生剧烈震动，接着莫名其妙便被传送到了人类世界某个游乐场内。为了保护灰太郎一家的安全，村长利用看看机将它们变成人类的模样。陌生的人类世界让他们既觉新奇又感慌乱，也由此闹出无数的笑话。可是他们发现一个严重的问题，宝贝儿子小灰灰似乎和他们走失了。另一方面，图谋将狼堡弄来人类世界的邪恶商人皮总正在酝酿一系列充满野心的罪恶计划。,喜羊羊与灰太狼/烂片/动画/中国/2012/中国电影/喜剧/动画片,2012,赵娜:1316498|梁颖:1316492|祖晴:1316493|高全胜:1316496|邓玉婷:1316494|刘红韵:1316495|朱予同:1322035|张琳:1316497,朱枫:1322001
5502109,土拨鼠,小白鼠,三轮瞳/桜井ふみ/大谷亮介/沖正人,,叶山阳一郎,3.5,120,剧情/恐怖,tt1799115,日语,60,http://marmot-movie.jp/,日本,2011/1/8,bqaizNm7e,美丽却颓废的女子挂川美咲（樱井富美 饰）正处在人生的最低谷，曾经她用身体换取短暂而虚幻的快乐，而如今无法规避的残酷命运碾压得她几乎喘不过气来。绝望的美咲借酒浇愁，不仅对酒精产生了极大的依赖，还使得第一个孩子出生时受酒精的侵蚀而先天右手麻痹。在儿童咨询处职员相马玲子（三輪ひとみ 饰）的建议下，再度妊娠的美咲决定接受相关治疗，以确保第二个孩子不会重蹈此前的覆辙。妇产科院长为她推荐了一款据说没有任何副作用但还未得到厚生省确认通过的新型药物。,日本/恐怖/cult/日本电影/变态/日影/恶心/2011,2011,三轮瞳:1038223|桜井ふみ:|大谷亮介:1343136|沖正人:,叶山阳一郎:1323335
6869516,逃犯,,,,,3.5,183,惊悚/恐怖,tt1727258,英语,98,http://Christine Evangelista,美国,,RuMIJBeib,某天，心理学学生艾比·琼斯（Christine Evangelista 饰）随同学还有教授一同前往帕克精神病院观摩。早在3年前，艾比罹患精神病的父亲便在这所医院自杀。可是为了帮更多患者走出阴影，这个勤奋勇敢的女孩还是踏入了这幢充满恐慌的建筑。在此期间，艾比意外遭到橙色高危精神病患者哈蒙（Dominic Purcell 饰）的袭击，备受惊吓。观摩结束之后，艾比返回寓所，与莱妮（Melissa Ordway 饰）和琳（Carly Chaikin 饰）两名好友进行考前复习。与此同时，哈蒙袭击看守人员后逃跑。警方在调查过程中发现，艾比与哈蒙被捕前杀害的女友十分相像。恶魔出笼，新的杀戮似乎即将展开……,惊悚/美国/烂片/犯罪/美国电影/2011/剧情/逃犯,2011,,
6013868,午夜凶梦,,钟欣潼/吴建飞/关智斌/周显欣/黄维德,,叶伟英,3.5,2423,悬疑/惊悚/恐怖,tt2473516,汉语普通话 / 粤语,90,,中国大陆,2011/11/25,eqqyrMmba,她叫方蕾（周显欣 饰），是一个容貌姣好、专业突出的外科医生，她的生活一丝不苟，甚至带点儿从医着过分敏感的洁癖。可是在她光鲜的外表下，却有着难以为人倾诉的痛苦。每当夜幕降临，那困扰多年的噩梦便如约而至。梦中，身着白衣的女子尾随方蕾，并以凄厉的声音叫着她的名字。这一切都令她痛苦不堪。,恐怖/钟欣桐/悬疑/烂片/中国电影/惊悚/中国/2011,2011,钟欣潼:1005138|吴建飞:1316060|关智斌:1015445|周显欣:1315025|黄维德:1030201,叶伟英:1316021
6772945,沼泽怪物,,,,,3.5,230,惊悚/恐怖,tt1686018,英语,0,,美国,2011/9/9,e6YBAuMmb,晴朗的日子里，海军陆战队员尼勒斯（Mehcad Brooks 饰）、奥斯卡（Dillon Casey 饰）、兰迪（Aaron Hill 饰）带着各自的女友驱车前往新奥尔良旅行度假。他们途径曾以出没杀人鳄鱼著称的柯林要塞，青年男女血气方刚，根本不会理会当地人的警告。此外，他们还讲述了关于格林姆里的传说。早在18世纪时，鲍廷家族勇敢健壮的格林姆里和妹妹相恋，可是妹妹却被鳄鱼吃掉。悲伤且愤怒的格林姆里杀死了鳄鱼，满怀悲愤地吃掉巢穴中的人肉和鳄鱼肉，从此化身为出没沼泽异型。青年们为这个故事所吸引，于是踏上了充满血光的死途……,恐怖/美国/惊悚/烂片/2011/美国电影/电影/垃圾,2011,,
6078953,赛尔号大电影之寻找凤凰神兽,赛尔号 / 赛尔号大电影：寻找凤凰神兽,张杰/武艺/曾轶可/何炅/李炜/谭杰希,,刘虹,3.5,1993,动画/奇幻/冒险,tt2027211,汉语普通话,90,http://seer.61.com/main/film/,中国大陆,2011/7/28,ZZnNmb6Yf,在一张古老而又神秘的地图上，记载了传说中未曾有人见到过的特异精灵，这张地图的现身，在宇宙中掀起了一场腥风血雨。平凡的机械师小墨（杨欧 配音），在误打误撞之中被卷入了宇宙海盗美利图（杨梦露 配音）一手策划的阴谋之中，遭到了对手的俘虏，赛尔号陷入了前所未有的危急情境之中。,动画/武艺/国产/中国/极品/史泰龙曾轶可傻傻分不清楚/2011/搞笑,2011,张杰:|武艺:|曾轶可:1314995|何炅:1313023|李炜:|谭杰希:,刘虹:
