MOVIE_ID,NAME,ALIAS,ACTORS,COVER,DIRECTORS,DOUBAN_SCORE,DOUBAN_VOTES,GENRES,IMDB_ID,LANGUAGES,MINS,OFFICIAL_SITE,REGIONS,RELEASE_DATE,SLUG,STORYLINE,TAGS,YEAR,ACTOR_IDS,DIRECTOR_IDS
25720817,贝尔女巫萦绕,猛鬼大录影,,,,3.8,178,惊悚/恐怖,tt2991532,英语,0,,美国,2013/8/23,6mVv6uUfa,《贝尔女巫萦绕》据真实事件改编，本片由罗伯逊县警长手机和摄像机的尸体上为素材，制造了一起灵异事件...by:,恐怖/惊悚/伪纪录片/美国/美国电影/2013/电影/伪纪录,2013,,
24872138,陆战特攻,陸戰特工(台),杜夫·龙格尔/马特·多兰/梅拉妮·萨内蒂/大卫·菲尔德,,克里斯托弗·哈顿,3.8,570,动作/科幻/冒险,tt2210463,英语,0,,美国,2013/7/12,zjzVnzVfa,东南亚已经成为许多生物工程技术公司的庇护之地，在摩加迪休（索马里首都），一种高传染性病菌从研究中心扩散到人群，病毒迅速入侵人体并致人于狂躁，犹如僵尸般生吃未受感染的人，城市陷入了毁灭的境地，雇佣兵迈克尔｀加特林受雇前往营救雇主的女儿，不断受到感染人群的死亡攻击，营救任务充满死亡气息⋯⋯,僵尸/动作/美国/科幻/美国电影/烂片/惊悚/2013,2013,杜夫·龙格尔:1040508|马特·多兰:1080668|梅拉妮·萨内蒂:1333788|大卫·菲尔德:1283671|Esteban Cueto:|Oda Maria:|Lydia Look:|Jen Sung:|Broadus Mattison:|Tim Cooper:1202993|Jeff Pruitt:|Kerry Wong:,克里斯托弗·哈顿:1382044
19962668,枕边有张脸,,吴其江/赵仕瑾/王翀/赵叶索/刘妙/耿英埔/陶慧/王芯,,赵小溪,3.8,2734,悬疑/惊悚,,汉语普通话,96,,中国大陆,2013/6/14,zzFZnFB2b,月黑风高的暴风雨之夜，刘灵（陶慧 饰）在一间小屋中发现三具疑似刚被人杀害的尸体，惊恐的她想逃走，不料一个黑色魅影缓缓爬了起来，刘灵发出骇人的尖叫。多年后，为寻找姐姐刘灵的下落，刘天（王舯 饰）、方文清（吴其江 饰）以及叶子（赵仕瑾 饰）等人再次来到鬼村。村口有一个无名碑，入夜以后，发生了一系列毛骨悚然的事情。第二天，大家在碑前看见刘天，原来他怀疑碑下是否埋葬着姐姐。刘天来到姐姐当年出事的鬼屋，发现了姐姐的骸骨，当夜刘天噩梦不断，他的精神崩溃了。此后，每当夜深人静，他们枕边就会出现一张只有头脸没有身体的鬼魂，他们还能离开这里吗......,恐怖/惊悚/国产/烂片/悬疑/枕边有张脸/中国/国产电影,2013,吴其江:1320286|赵仕瑾:1329003|王翀:1329159|赵叶索:1329160|刘妙:1329161|耿英埔:1329164|陶慧:1341176|王芯:1329454,赵小溪:1323628
19961119,夏日示爱,两情双月,邓家佳/王传君/黄一飞/林雪/吴辰君/杨恭如,,陈家霖,3.8,595,喜剧/爱情,,汉语普通话,94,,中国大陆 / 中国香港,2013/8/30,RIv6mFZva,在素有 “小马尔代夫”之称五星度假岛双月湾，蓝天、沙滩、游艇、比基尼长腿美女、阳光美男……都构成了一幅充满了“浪漫”“艳遇”“一见钟情”关键字的画面，然而这一切都与在这儿土生土长的苏嘉琳（邓家佳 饰）无关，她只想着划着她的小艇在海天一线的地方用相机捕捉美景。然而一艘像“大螃蟹”一样横冲直撞的游艇轻易地让她的相机与她的美梦一起“泡汤”了。事故肇事者是某知名财团二公子娄皓（王传君 饰），两人就此结怨。,爱情/喜剧/2013/大陆/中国/这种电影不就是个炮灰么。/大陆爱情/双月湾,2013,邓家佳:1274361|王传君:1313837|黄一飞:1301215|林雪:1274279|吴辰君:1023550|杨恭如:1016866,陈家霖:1323624
22966167,聚客镇,,陈志朋/贡米/孙兴/潘元甲/田华/赵毅/张宇彤/田小辉/周明灿/乔治·安东,,武洪武,3.8,92,剧情,tt2640512,汉语普通话,90,,中国大陆,,rU3FZZv6e,孙兴等主演的电影《聚客镇》讲述了明末清初，在聚客镇的一户人家中突现出现了一个至宝。而这个至宝就是早已失传多年的镂空玉雕，随着这个镂空玉雕在当地的出现，这个消息很快就传到了江湖之上，而且引来了各路人马，虽然形形色色的人马都到了这个地方，并且都对这个如意至宝垂涎三尺。而这个宝物的所有者玉匠水捞子父子，也正是因为这件宝物俩人成了万众瞩目的名人。各种的好事都出现在了他们的身上。但是与此同时麻烦也随着宝贝的出现而到来。各路人马开始了宝物的纷争，可是在这个纷争的的背后却隐藏着一段不为人知的血泪情仇。这背后到底隐藏着怎样的故事呢？这个宝物又会给他们带来什么？,剧情/爱情/中国/大陆/2014/陈志朋/真情/孙兴,2013,陈志朋:1274865|贡米:1275005|孙兴:1150721|潘元甲:1320547|田华:1181025|赵毅:1314844|张宇彤:1316421|田小辉:|周明灿:1327240|乔治·安东:1329969,武洪武:1324913
24743729,太空熊猫历险记,太空熊猫,易小寅/苏俣/乔菲菲/李溯/张馨予/郭珊/章一/王晗/王黎,,郑成峰,3.8,117,动画/奇幻/冒险,,汉语普通话,84,,中国大陆,2013/12/28,qqE3NeaEf,宇宙中熊猫星球的太空熊猫为了保护熊猫星球与黑暗宇宙的天狼鼠大战，从而引发了宇宙大爆炸，随着宇宙大爆炸的能量旋窝，太空熊猫意外闯入地球，并结识地球上的小泰、小尚以及六福星球的啾啾马、哞哞牛、咩咩羊、咯咯鸡、汪汪狗、哼哼猪几个基因宝贝，大家在一起搞怪卖萌。,动画/国产/太空熊猫/国产动画烂片/中国/3D/烂片/我想看这部电影,2013,易小寅:1340204|苏俣:1340250|乔菲菲:|李溯:|张馨予:|郭珊:|章一:|王晗:|王黎:,郑成峰:1336404
25742254,少女灵异日记,,路晨/冯波/周野芒/伍麟凯/韩一菲,,许斌,3.8,3325,惊悚/恐怖,tt7526316,汉语普通话,91,,中国大陆,2013/11/11,jzNuiNuaa,故事发生在1947年的天津卫。郑心凌（路晨 饰）是富商之女，平日里衣食无忧，过着公主般的生活，怎奈天有不测风云，母亲突遇车祸身亡，心凌深受打击，不久竟患上抑郁症。宁雅（冯波 饰）是一名留洋归国的心理医生，他问诊后把心凌带到一处幽静山庄进行治疗。入住山庄后，心凌发现了一本看似普通的日记本，但当她翻看内容后，一连串诡异的现象接踵而至，先是有人离奇死亡，后来每到午夜时分，山庄便响起鬼魅魉魑的恐怖音乐，渗血的人体标本也随之出现。紧接着，更怪异的现象出现了，那是一个停电的夜晚......,恐怖/灵异/惊悚/烂片/悬疑/少女/中国/中国电影,2013,路晨:1317301|冯波:1316822|周野芒:1275865|伍麟凯:1335184|韩一菲:1322811,许斌:1335182
10555077,小矮妖的复仇,,,,,3.8,51,科幻/悬疑/惊悚,tt1876454,英语,0,,美国,2012/3/16,NeEBmb6ua,"是Drew Daywalt 为美国Syfy电视台拍的电视电影。An evil leprechaun who has been imprisoned within the roots of a majestic old oak tree, is accidentally set loose on St. Patrick's Day. Once free, he takes out his bloody revenge on the descendants of the people who originally imprisoned him .",惊悚/美国/2012/恐怖/电影/科幻/我看过的惊悚电影/美国电影,2012,,
24526792,脱衣麻将秘密俱乐部,脱衣麻雀,星野光/葵野まりん/小林さや/舞阪エリル,,,3.8,111,惊悚/犯罪,,日语,66,,日本,2012/8/3,3VBAIJJ3b,多额の借金を抱えるＯＬ.水岛沙耶香は、ある日、极乐金融から借金を帐消しにしてくれるという文面の叶书を受け取る。この叶书に兴味を示した沙耶香は、早速极乐金融に出向いてみる。そこには同じように借金返济に恼む女性３名がいて、极乐金融の社长から麻雀の胜负について说明を受ける。最后まで残った胜者は全ての借金が帐消しになるが、败者には严しい罚が…。,日本/情色/伦理，禁片，人性/日本电影/脱衣麻将/脱衣麻雀/像妖怪一样的文艺青年/2012,2012,星野光:1317572|葵野まりん:|小林さや:|舞阪エリル:,
20491296,胶片里的罪恶,,杰西卡·莫里斯 Jessica Morris/凯维·莱曼-默塞尤/杰夫·阿德勒,,,3.8,58,恐怖,tt2388920,英语,78,,美国,,vaiN2zr6e,Kennedy、Cory和James三个好朋友一直都希望可以自己拍电影，一次偶然的机会可以让他们实现自己的梦想，可是万万没有想到的事情发生了。究竟他们可以拍出像好莱坞出产的好电影吗？,美国/惊悚/伪纪录片/美国电影/恐怖/电影/伪纪录/2012,2012,杰西卡·莫里斯 Jessica Morris:|凯维·莱曼-默塞尤:1369904|杰夫·阿德勒:1396332|Jamie Bernadette:,
10432937,乌龙戏凤2012,宝岛大爆走 / 宝岛奇遇记,陈怡蓉/澎恰恰/苑新雨/九孔,,罗安得,3.8,1406,喜剧,tt2454898,汉语普通话,99,,中国台湾,2012/1/27,jzjrijVnb,谭艳飞（苑新雨 饰）长相甜美个性开朗，是个彻彻底底的“萌妹子”。某日，为了庆祝十八岁的生日，谭艳飞和同学们一同来到了宝岛台湾，开始了属于他们的精彩旅程。一场意外中，吃货谭艳飞为了寻找宝岛美食，和同伴们走散了，迷失于纵横交错的大街小巷之中，之后，她竟然遇到了绑匪，遭到了绑架。,台湾电影/喜剧/台湾/烂片/2012/陈怡蓉/澎恰恰/这也算喜剧？,2012,陈怡蓉:1274730|澎恰恰:1315898|苑新雨:1270480|九孔:1274213,罗安得:1349689
5951224,荒岛情未了,,陈龙/曹曦文/蒋小涵/戴凌鹏/任珈锐,,喻瀚湫,3.8,665,悬疑/惊悚/冒险,,汉语普通话,99,,中国大陆,2012/4/13,3baUZnVZf,年青帅气的公司CEO、貌美的女经理、“五星级饭店”主厨以及一班昔日大学同窗在一次聚会上酒醉驾船出海，谁料到一阵突如其来的风暴将这艘豪华游艇击沉。清醒后的他们背流落到一个无名岛屿，迷失荒岛中的他们面临危机四伏的险境，食物短缺加上寄居的山洞崩塌，然而比环境更险恶的是捉摸不透的人心，为了生存，曾经的同学会变成猎人还是猎物，一场大逃杀即将开始.....,中国/中国电影/你说这事烂片不·····/2B青年一箩筐/电影/烂片/剧情/悬疑,2012,陈龙:1314478|曹曦文:1274603|蒋小涵:1313889|戴凌鹏:1318727|任珈锐:1321155,喻瀚湫:1318842
10759842,毕业那年,,顾莉雅/朱文超/叶青青/王仲欣/丁汀/飞龙/龙泽,,姚宇,3.8,1933,剧情/音乐,,汉语普通话,88,,中国大陆,2012/9/21,zFZBuaUnb,某艺术大学的美术系学生艾拉（顾莉雅 饰）已经大四，是系里不可多得的灵魂人物。在一次辩论赛中，艾拉带领着同系好友吴婷婷（叶青青 饰）、苏露露（王仲欣 饰）等一路过关斩将，重创劲敌音乐系。音乐 系的大龙（龙飞 饰）、二龙（龙泽 饰）、富二代路人丁（丁汀 饰）以及旁听生三强不 甘就这样被几个黄毛丫头给打败，几个人找到才华横溢的康林（朱文超 饰）求救.....,青春/毕业/校园/烂片/大陆青春/2012/中国/中国电影,2012,顾莉雅:1321802|朱文超:1322055|叶青青:1322056|王仲欣:1322057|丁汀:1322060|飞龙:1322058|龙泽:1322059,姚宇:1322053
25812299,美景之屋：美味的性,,,,,3.8,176,爱情/情色,,韩语,55,,韩国,2012/12/19,Z3NI372Ff,,情色/韩国电影/韩国/电影/电影不错/韩国R级/限制级/日韩,2012,,
20376561,床下魔怪,床底下,盖特林·格里菲斯/皮特·霍尔登/穆赛塔·万德,,史蒂芬·C·米勒,3.8,247,恐怖,tt1934458,英语,87,,美国,2012/7/19,zVnba6YJf,曾经一系列事件让霍斯曼一家经历了巨大的变动。在母亲去世后，作为长子的尼尔（约翰尼·韦斯顿 Jonny Weston 饰）因精神问题与家人暂时离别。两年之后，父亲泰瑞（皮特·霍登 Peter Holden 饰）迎娶新妻安吉拉（穆赛塔·万德 Musetta Vander 饰）。借此机缘，尼尔得以回到家中，并与日夜思念的弟弟保列（盖特林·格里菲斯 Gattlin Griffith 饰）重聚。短暂的快乐并未持续多久，旧日的噩梦很快抬头。尼尔坚信当初他的床下藏有恐怖妖怪，而这一切似乎也与母亲之死些许相关。他依旧神神叨叨的样子令父亲又苦恼又气愤，孤独无助的他只有依靠与自己感情最深的弟弟。,恐怖/美国/惊悚/莫名其妙/烂片/2012/恐怖片/美国电影,2012,Jonny Weston:|盖特林·格里菲斯:1315243|皮特·霍尔登:1030065|穆赛塔·万德:1018025|Kelcie Stranahan:1238651|Ivan Djurovic:,史蒂芬·C·米勒:1032824
3268186,送信者,,,https://img1.doubanio.com/view/photo/s_ratio_poster/public/p1516472258.jpg,汉尼·阿布-阿萨德,3.8,408,动作/惊悚/犯罪,tt0995845,英语,95,,美国,,mVBuURYRe,故事叙述一个总是冒着生命危险的「送货员」，这次接获的任务是要将一个神秘公事箱交给一位行踪不定的黑帮老大，而在运送途中与贪腐警察和其他帮派份子展开一场致命抢夺战，到底箱子里装的是什么？,美国/犯罪/动作/烂片/美国电影/2011/剧情/何超仪,2012,,汉尼·阿布-阿萨德:1055315
20395350,迷失的岛屿,,,,,3.8,122,剧情/冒险,tt1700468,法语,0,,法国 / 留尼汪,,aqMAQQmVf,1942年，三名男子坠落到了海上，他们在附近荒岛上找到了栖息之地。慢慢地，他们发现其实自己并不孤单……,法国/烂片/科幻/2011/电影/神秘/法国电影/欧洲电影,2011,,
6866843,黑暗复仇,,史蒂文·席格/凯尔·卡西/劳洛·查坦德,,,3.8,76,剧情/动作/犯罪,,英语,0,,美国,,bMm72zNAe,在美墨边境有个无人荒岛，一般人从不敢登陆造访，因为岛上只有嗑药的流浪汉及前科犯人。一天有一对不怕死的年轻人却在岛上莫名消失了，德州州警格兰强森(布莱德强森)奉命追查真相，决定向无人岛挑战，并跨越国界到一个陌生的荒岛办案。 在办案的过程中，格兰强森发掘了真相，却也经历了许多极端的选择与矛盾，加上唯一女证人梅兰达，又是如何介入格兰强森复杂的侦查呢？,美国/动作/犯罪/史蒂文席格/不好看，没头没脑的/2011/黑色幽默/重口味,2011,史蒂文·席格:1002685|凯尔·卡西:1174425|劳洛·查坦德:1027501,
11504880,爱裸武战队,,希崎·杰西卡 Jessica Kizaki/穂积あおい/亚纱美 Asami,,,3.8,222,喜剧/动作/爱情/科幻,tt3443342,日语,75,,日本,,Ff6m7eaib,20XX年，淫贱怪人组织“去死去死去死去死团”入侵东京祸害百姓，危急之际，三位美女挺胸而出，运用爱的力量变身为正义战队“爱裸武战队”与邪恶势力展开激战！,日本/情色/喜剧/动作/科幻/爱裸武战队/2011/CULT,2011,希崎·杰西卡 Jessica Kizaki:|けーすけ/:|穂积あおい:|亚纱美 Asami:,
6721638,洪吉童 2084,,,,,3.8,71,动画/冒险,tt2008534,韩语,82,,韩国,2011/8/18,yz7QYBeMe,2084年，顶尖都市栗岛。从小遭到兄长洪日童厌恶、被赶离飞船的洪吉童和挚友哲伊相依为命。一天，他们在树丛遭到危险攻击，被美女战士夏玲救下，从栗岛百姓那里得知洪日童的诸多恶行。恢复栗岛城的和平、彻底把哥哥为首的恶势力赶尽杀绝，洪吉童和朋友们踏上了一条艰辛的拯救之路……,动画/韩国/动画电影/奇幻/2010+/电影/2011/科幻,2011,,
6829363,坍塌,崩塌末日,,,,3.8,76,剧情/科幻/惊悚/恐怖,tt1734122,英语,0,http://www.thecollapsed.com/,加拿大,2011/5/27,QYnNYBYJf,世界末日即将到来，一个绝望四口之家想要逃离这一切。他们的想要逃离城市，前往他们曾经称之为家的偏僻郊区。死亡的恐怖一直笼罩着，他们不得不尽可能远离城市文明，他们逃到了森林里，马上发现了其他幸存者带来的危险远不及真正的死亡可怕。他们会逃过此难吗？一场黑暗和无法预料的恐惧正要降临~~,惊悚/加拿大/科幻/加拿大恐怖片/简直是无聊透顶的片子/2011/恐怖/灾难-生化,2011,,
6843093,闯堂兔,闯堂兔大电影,闯堂兔/闯堂小兔/萝卜,,曾宪林,3.8,157,喜剧/动画,,汉语普通话,90,,中国大陆,2011/10/1,QIRQeUBYf,宁静祥和的闯堂镇，即将迎来万众瞩目的许愿大会，镇民们为了这次盛典齐心协力。闯堂兔的父亲兔飞是一个极为聪明博学的博士，此前博士因某种原因带着“闯堂之轮”从小镇消失，气坏了身为镇长的爷爷，从此兔博士和“闯堂之轮”便成了小镇的禁忌话题。虽然也闯堂兔和弟弟堂堂参与盛典的准备工作，可是手忙脚乱惹出不少的笑话。在爷爷的呵斥下，他们随同美丽的小猫蝴蝶前往神殿检查电力系统，却意外在地下发现神秘之人，这些人似乎正策划破坏盛典。为了保证许愿大会的顺利进行，闯堂兔他们齐心协力和这群坏蛋作斗争，结果发现背后隐藏着更大的阴谋……,动画/烂片/中国/超级期待/搞笑/2011/白痴/电影,2011,闯堂兔:|闯堂小兔:|萝卜:,曾宪林:
6804380,灰姑娘,鬼虐杀,,,,3.8,1151,惊悚/恐怖,,泰语,0,,泰国,2011/3/10,2jVfiNQIf,获奖无数的恐怖片导演受邀拍摄一部新的鬼片，投资商点名要求当红小生那成出任男主角，这可愁坏了剧组人员。因为那成不仅脾气暴躁、傲慢无理，他的妈妈更是神神道道，深信各种法术，并想尽办法帮儿子的事业助力。在整个拍摄过程中，那成母子和剧组人员的摩擦不断，矛盾最终在某小岛上爆发。那成在和剧组争吵时被道具刺伤眼睛，之后更跌落山坡，遭汽车碾压而死。悲剧并未阻止影片的拍摄，剧组选了名不见经传的年轻人阿弩接替那成的位置。,泰国/恐怖/惊悚/泰国电影/2011/血腥/电影/恐怖电影,2011,,
5156833,驯龙战,龙腾世纪 / 龙之寿,丹尼·格洛弗/维尼·琼斯/柯里·瑟威尔/索非亚·佩尔纳斯/拉里·巴格比,https://img3.doubanio.com/view/photo/s_ratio_poster/public/p917432792.jpg,瑞恩·雷特尔,3.8,570,动作/科幻/惊悚/奇幻,tt1594917,英语,91,,美国,2011/3/4,2NQIRe6ea,故事发生在一个虚构的神话世界中，哈亚（丹尼·格洛弗 Danny Glover 饰）是业界闻名的猎龙人，他发明了战船，以其骁勇善战的个性著称，然而，只有哈亚自己清楚，自己的内心里究竟隐藏了多少的脆弱和悔恨。,美国/奇幻/科幻/烂片/2011/动作/美国电影/魔幻,2011,丹尼·格洛弗:1010571|维尼·琼斯:1013804|柯里·瑟威尔:1009443|索非亚·佩尔纳斯:1254749|拉里·巴格比:1059277|McKay Daines:1306362,瑞恩·雷特尔:1000639
5151226,隐藏,,,,,3.8,77,惊悚/恐怖,tt1664664,英语,79,,意大利 / 加拿大,,NAQe6AQAe,在一座为白雪覆盖的深山腹地，坐落着一家名为迪瓦恩的精神病患者康复中心。在过去的几十年里，康复中心负责人神经科医生苏珊·卡特（杜恩·福德 Dawn Ford 饰）一直致力于病毒试验，她的研究取得一定成效，却也因为涉嫌对病人进行非人道实验引来不少的非议和指摘。某天，苏珊卡特去世，始终与其关系冷淡的儿子布赖恩博士（西恩·克莱蒙特 Sean Clement 饰）意外成为康复中心的负责人。在朋友西蒙（杰森·布里克 Jason Blicker 饰）的鼓动下，布赖恩等人驱车来到康复中心。,恐怖/意大利/惊悚/加拿大/电影/2011/恐怖片/美国,2011,,
6507723,鬼上身,拉吉妮的恐怖实录 / 鬼玩人 / 鬼镜头,,,,3.8,73,剧情/悬疑/恐怖,tt1890513,,0,,印度,,BeU3VJf6e,拉基妮和乌代去森林深处的小屋里度周末，乌代计划偷拍拉基妮的私密视频，以此得到成为演员的机会，而拉基妮对此毫不知情。然而，他们的周末被拉基妮的朋友打搅了，从朋友口中得知这所房子属于一位被称作女巫的女人，她被家人杀害，成为了复仇的鬼魂为自己报了仇。朋友感到了房子中的异常，离开了拉基妮和乌代。之后发生了各种诡异的事情。,恐怖/印度/印度电影/鬼影实录/2011/纪录片/记录/摄像,2011,,
3993427,靠岸,,李勇/吴颖/康殿宏/郑明泰,https://img3.doubanio.com/view/photo/s_ratio_poster/public/p2370758921.jpg,张荣贵/陈之任,3.8,64,动画,tt1519469,汉语普通话,81,,中国台湾,2010/3/5,UReijjzNe,创造虚拟偶像“阿贵”的张荣贵所拍摄第一部动画长片。少女“冷光飘浮”在码头上等待爱人“西风间树”，就在开船的前一刻，战事爆发，女孩在混乱中上了一艘奇幻的黑鲸船，船上满载失意的灵魂，但男孩却没有现身。剧情在不同的时空中跳跃，有如线上游戏，而战争的结束与爱情的得与失，都系于一名充满我执的少女身上。,动画/台湾/台湾电影/台语/台灣/2010/电影/烂片,2010,李勇:|吴颖:|康殿宏:|郑明泰:,张荣贵:|陈之任:
3287924,致命毒岛,暗岛,,https://img1.doubanio.com/view/photo/s_ratio_poster/public/p2262442597.jpg,,3.8,216,动作/科幻/惊悚,tt1043651,英语,87,,加拿大,2010/9/2,rqaMmrMYf,财大气粗的Altracorp公司在英属哥伦比亚省静河附近的一个无人小岛秘密进行一项生化实验，虽然遭到美国民众的一致反对，但是凭借其高超的公关手段以及政府的暗中支持，该实验仍在继续。然而一则令Altracorp头疼的消息传来，该小岛上的实验似乎发生差错，所有研究人员全部下落不明。为了找到生还者，查明失踪原因，公司派出由雷蒙德·华（Zero Kazama 饰）、瑞雪·甘特（Mary Christina Brown 饰）、苏菲·米勒（Victoria Floro 饰）、艾伦·崔斯坦（Rob O'Brien 饰）以及维尔·凯恩（Jai Koutrae 饰）5人组成的救援小组，开赴那个与世隔绝的神秘小岛。,惊悚/恐怖/加拿大/科幻/美国/真的很烂/电影/美国电影,2010,,
4707237,我的野蛮女友2,,熊黛林/立威廉/何炅/冯媛甄/黄宗泽,,马伟豪,3.8,7591,喜剧/爱情,tt1997605,汉语普通话 / 粤语,88,,中国大陆,2010/11/5,JZJfaqEJf,一个月前，尚真（熊黛林 饰）来到韩国首尔，偶遇了向女友求婚失败的书店老板健宇（立威廉 饰），健宇为人温厚善良，让沉浸在遭受男友背叛的痛苦中的尚真忽然萌生了一个想法：要利用健宇帮自己破坏男友的婚礼。于是，健宇跟随尚真来到中国，回家的尚真暴露出了“野蛮”的一面，对远道而来的国际友人疏于照顾。尚真的表妹永真（冯媛甄 饰）和姐姐一样令男人头疼，担任跆拳道教练的永真班中有一名缺乏男子气概的学员志凯（何炅 饰），志凯对永真仰慕有加，但却时常在永真的拳脚下吃亏。健宇陪伴尚真进行破坏婚礼的准备工作，却在演习中得罪陌生人，而此时，距离婚礼的日期越来越近了……,爱情/我的野蛮女友2/喜剧/何炅/熊黛林/中国电影/立威廉/2010,2010,熊黛林:|立威廉:|何炅:|冯媛甄:|黄宗泽:,马伟豪:
4022622,魔偶奇谭9：邪恶轴心,魔偶奇谭 / 傀儡王：邪恶轴心 / 魔偶奇谭10邪恶轴心,,https://img3.doubanio.com/view/photo/s_ratio_poster/public/p2436360093.jpg,,3.8,183,科幻/惊悚/恐怖/战争,tt1504467,英语,83,,美国,,zNmbUnjjb,时值二战时期，一心希望参战却遭到母亲阻止的丹尼在叔叔的租房打工的时候认识一位木偶师，木偶师拥有让木偶自己动起来的神奇力量。而纳粹也看中了这种力量想夺为己用。好心的丹尼把木偶们带回在唐人街的自己家里修理，然而日本人和德国人已经混进去，纳粹大战木偶的故事就此展开......,美国/恐怖/玩偶/美国电影/烂片/2010/电影/傀儡王：邪恶轴心,2010,,
3281212,野营地狱,,安德鲁·麦卡锡/达娜·德拉尼/康勒·帕奥罗/杰西·艾森伯格/布鲁斯·戴维森,https://img3.doubanio.com/view/photo/s_ratio_poster/public/p2265974362.jpg,,3.8,92,惊悚/恐怖,tt1047449,英语,91,,美国,,JJvUfUZJf,每当夏季将要结束的时候，新泽西某个基督教社区的孩子们都要参加一项集体活动。他们会被带领着远离尘嚣进入森林中，在那里由牧师进行基督教义的教导。然而没有想到的是，在此过程中一行人遭遇了恐怖袭击……,JesseEisenberg/美国/惊悚/恐怖/烂片/美国电影/宗教/jesse,2010,安德鲁·麦卡锡:1036345|达娜·德拉尼:1031899|康勒·帕奥罗:1009369|杰西·艾森伯格:1027144|布鲁斯·戴维森:1010630,
5158274,辛巴达与牛头怪,,,,,3.8,55,科幻/奇幻/冒险,tt1577065,英语,0,,澳大利亚,,6AAmNInVf,"Sinbad, armed with rumors of ancient gold, finds himself sneaking into the desert camp of the evil sorcerer Al-Jibar. Hidden among the many relics is an ivory scroll case containing the logs of the pirate Captain Minos, which will lead Sinbad to the golden head of the Colossus of Rhodes.",澳大利亚/魔幻/冒险/科幻/澳洲电影/烂片/澳大利亚电影/差,2010,,
